<architecture xmlns:xsi="http://www.w3.org/2001/XMLSchema-instance" xsi:noNamespaceSchemaLocation="adl.xsd">  <subarchitecture idsubarchitecture="backend">
    <component id="comp1" name="comanche.fraclet.Analyzer">
      <providedinterface idinterface="id5" name="a" signature="comanche.fraclet.IAnalyzer" />
      <requiredinterface idinterface="id6" name="id" signature="comanche.fraclet.IDispatcher" />
      <requiredinterface idinterface="id7" name="l" signature="comanche.fraclet.ILogger" />
    </component>
    <component id="comp2" name="comanche.fraclet.Logger">
      <providedinterface idinterface="id8" name="l" signature="comanche.fraclet.ILogger" />
    </component>
    <component id="comp3" name="comanche.fraclet.Dispatcher">
      <providedinterface idinterface="id9" name="id" signature="comanche.fraclet.IDispatcher" />
      <requiredinterface idinterface="id10" name="ifh" signature="comanche.fraclet.IFileHandler" />
      <requiredinterface idinterface="id11" name="ieh" signature="comanche.fraclet.IErrorHandler" />
    </component>
    <component id="comp4" name="comanche.fraclet.FileHandler">
      <providedinterface idinterface="id12" name="f" signature="comanche.fraclet.IFileHandler" />
    </component>
    <component id="comp5" name="comanche.fraclet.ErrorHandler">
      <providedinterface idinterface="id13" name="e" signature="comanche.fraclet.IErrorHandler" />
    </component>
    <component id="comp6" name="comanche.fraclet.Logger2">
      <providedinterface idinterface="" name="l2" signature="comanche.fraclet.ILogger" />
    </component>
    <component id="comp7" name="comanche.fraclet.Logger3">
      <providedinterface idinterface="" name="l3" signature="comanche.fraclet.ILogger" />
    </component>
    <component id="comp8" name="comanche.fraclet.Logger4">
      <providedinterface idinterface="" name="l4" signature="comanche.fraclet.ILogger" />
    </component>
    <component id="comp9" name="comanche.fraclet.Logger5">
      <providedinterface idinterface="" name="l5" signature="comanche.fraclet.ILogger" />
    </component>
    <component id="comp10" name="comanche.fraclet.Logger6">
      <providedinterface idinterface="" name="l6" signature="comanche.fraclet.ILogger" />
    </component>
    <component id="comp11" name="comanche.fraclet.Logger7">
      <providedinterface idinterface="" name="l7" signature="comanche.fraclet.ILogger" />
    </component>
    <component id="comp12" name="comanche.fraclet.Logger8">
      <providedinterface idinterface="" name="l8" signature="comanche.fraclet.ILogger" />
    </component>
    <binding clientcomponent="comp1" clientinterface="id7" servercomponent="comp2" serverinterface="id8" />
    <binding clientcomponent="comp1" clientinterface="id6" servercomponent="comp3" serverinterface="id9" />
    <binding clientcomponent="comp3" clientinterface="id10" servercomponent="comp4" serverinterface="id12" />
    <binding clientcomponent="comp3" clientinterface="id11" servercomponent="comp5" serverinterface="id13" />
    <exportedinterface idinterface="id5" />
  </subarchitecture>
</architecture>